,id_поста,text_tokens,text_length,preprocessed_comments
111,977,тик тик конец близкий завтра завершаться м документ прохождение вступительный испытание бюджет упустить возможность поступить гуап подавать документ ещё сделать пока смотреть видеоролик наш звёздный выпускник дмитрий хрустать ва мочь добиться высота главное верить стремиться,35,[]
112,964,связь наш абитуриент георгий который удовольствие поделиться свой эмоция поступление рассказать узнать гуап гуап узнать сайт поступить онлайн способ подавать документ свой консервативный мнение подавать документ лично абитуриент тяжело абитуриент нелегко решаться дальнейший судьба близкий время тяжело проходить период ожидание результат твой эмоция поступление оправдаться ожидание ещё поступить рад никакой трудность подача документ возникать вс проходить чётко специальность выбрать подать документ направление международный отношение юриспруденция душа большой лежать гуманитарный наука оставаться вопрос писать личный сообщение группа беседа абитуриент,78,"[('радость видеть институт', 3)]"
113,951,хотеть выиграть главный приз скоро выйти очередной выпуск гуап поколение поздний главный розыгрыш м возможность увеличить свой шанс победа предупреждать прийтись постараться отвечать вопрос комментарий учт м начислить балл балл суммировать учесть финальный розыгрыш большой правильный ответ большой балл сколько институт факультет гуап памятник значимый персона россия стоить внутренний двор корпус большой морской стать последний участник выпуск гуап поколение охранять чесменский дворец мифологический персонаж изобразить витраж главный лестница корпус большой морской писать свой ответ комментарий получать балл забыть поставить лайк получить свой балл оставаться вопрос писать личный сообщение группа беседа абитуриент,91,"[('институт факультет', 2), ('екатерина второй', 2), ('институт факультет вуц екатерина второй великий александр иванов зел ная лягушка крыло воздушный шар спутник', 15), ('фптить факультет институт считать вуц непрерывный дистанционный образование екатерина второй александр иванов лягушка золотой крыло', 15), ('институт факультет вуц екатерина второй великий александр иванов зел ная лягушка крыло воздушный шар спутник', 15), ('институт факультет вуц екатерина второй великий александр иванов зел ная лягушка крыло воздушный шар спутник', 15), ('фптить иваногородский филиал факультет вуц екатерина великий александр иванов золотой лягушка крыло воздушный шар спутник', 15), ('институт факультет вуц памятник екатерина второй александр иванов зелёный лягушка спутник воздушный шар крыло', 14), ('институт факультет любимый вуц ещё индо екатерина второй александр иванов лягушка крыло воздушный шар спутник', 15), ('институт факультет вуц екатерина великий александр иванов зел ная лягушка крыло воздушный шар спутник', 14), ('институт памятник екатерина александр иванов золотой лягушка спутник воздушный шар крыло', 11)]"
114,949,хотеть летать присоединяться инженерный школа гуап год гуап усиление подготовка студент формирование исследовательский прикладной проект создать специализировать лаборатория беспилотный авиационный система инженерный школа гуап лаборатория позволять решать определённый задача полный цикл сборка квадрокоптер исследование полётный характеристика лаборатория состоять часть зона моделирование проектирование настройка беспилотный авиационный система полезный нагрузка зона экспериментальный пилотирование разработать беспилотный система монтажный зона оснастить современный компьютер выполнение моделирование узел агрегат беспилотный система программный обеспечение калибровка дрон понравиться присоединяться вопрос задавать личный сообщение группа беседа абитуриент,78,[]
115,946,внимание внимание напоминание июль заканчиваться приём документ направление бакалавриат специалитет прохождение вступительный испытание бюджет квота упускать свой шанс стать студент первый аэрокосмический появляться вопрос задавать личный сообщение группа беседа абитуриент,30,[]
116,943,слово декан гуап константин лосев декан гуманитарный факультет профессор ответить часто задавать вопрос абитуриент интервью узнать возможность открываться студент гуманитарный факультет направление поступить год предприятие сотрудничать факультет читать статья узнавать новый факультет встреча первый аэрокосмический,35,"[('', 0)]"
117,940,мный комиссия гуап связь очередной прямой эфир час комиссия стартовать сегодня трансляция разобрать основной вопрос абитуриент касаться кампания свой вопрос мочь задать чат эфир оказаться непонятный писать личный сообщение группа чат абитуриент гуап,33,"[('', 0)]"
118,935,успеть побывать комиссия гуап непременно жд м абитуриент мочь посетить исторический здание посмотреть атмосфера царить ул якубович далее возможность приехать увидеть вс свой глаз листать карусель присоединяться встреча первый аэрокосмический,30,"[('', 0), ('милашка', 1), ('красавчик', 1)]"
119,933,третий выпуск гуап поколение гора скоро увидеть наш следующий гость выпускник гуап брат близнец встречать ярослав бузиновый заместитель главное инженер ао радар ммс илья бузиновый директор научно производственный комплекс ао радар ммс ярослав илья рассказать почему выбрать гуап выбирать специальность поступление насколько оправдаться ожидание обучение гуап яркий воспоминание остаться память вуз ошибиться абитуриент выбор готовый брать студент гуап производство подписываться пропустить новый выпуск,63,[]
120,929,звёздный выпускник гуап сегодня поговорить наш звёздочка альбин хузина который являться председатель профбюро выпускница гуап героиня рассказать свой путь университет рассказать направление подготовка окончить привет год окончить бакалавриат специальность технология транспортный процесс планировать продолжать обучение гуап магистратура почему выбрать гуап выбрать гуап интересный направление широкий возможность который открывать университет любой студент проходить производственный практика практика группа проходить пулково протяжение месяц ездить аэропорт работать агент проект взлётный полоса дисциплина запомниться почему большой весь запомниться предмет теория транспортный процесс система который вести директор институт николай майоров протяжение весь семестр исследовать работа морской порт воздушный пространство использовать реальный приложение который работать специалист наш область каждый день очень интересный полезный дисциплина хороший воспоминание студенческий жизнь хороший воспоминание очень тепло вспоминать время провести университет насыщенный студенческий жизнь прекрасный друг который надеяться далёкий идти жизнь самый главное подарить университет взросление множество урок жизнь заниматься внеучебный время внеучебный время активист профком гуап го курс стать председатель профбюро свой институт помогать студент делать жизнь яркий интересный участвовать внутривузовский региональный всероссийский конкурс почему стоить выбирать гуап думать стоить выбирать гуап хороший старт реализация поиск возникать трудность подача документ вопрос кампания задавать личный сообщение группа беседа абитуриент,187,[]
121,927,сколково очередной победа гуап москва территория инновационный центр сколково проходить всероссийский научно спортивный фестиваль связь мероприятие участвовать выпускник студент старший курс специальность гуап фестиваль поехать студент институт информационный технология программирование студент принять участие хакатон команда час предстоять решить непростой задание основа который реальный промышленный кейс умный производство задание включать разработка виртуальный реальность прототип умный производство выпуск автомобиль создание полноценный сцена цех использование движок прототипирование жюри оценивать проект критерий соответствие задание работоспособность полезность итог хакатон команда гуап занять первый место хотеть ждать первый аэрокосмический,83,"[('первый место молодец', 3), ('поздравлять победа', 2), ('держать', 1)]"
122,924,час лето марафонец хотеть начать заниматься спорт откладывать бояться получиться считать сложно скучно волноваться показать сделать весело интересно хороший спортивный проект студент направить популяризация здоровый образ жизнь внедрение спорт повседневность студент участник смочь освоить бег основа техника помощь еженедельный задание подготовиться забег белые ночь марафон начать вести здоровый образ жизнь новый полезный привычка погрузиться мир нутрициология узнать принцип правильный питание пробовать новый вид спорт каждый неделя проводить время крутой компания давать послушать проект думать экс руководитель георгий батайкина студент нужный проект час лето заставить утром бегать сложно сделать привычка вообще давать представимый переехать город стресс переезд голова забитый учёба мысль грязный посуда непостирать вещь сель покрасить друг друг ситуация бег здоровый образ жизнь приходить помощь проект час лето подсказать правильно питаться следить свой здоровье рассказать начать заниматься спорт навредить знать заняться выходной организовать спортивный двизать профбилет двизать дешёвый достигнуть участник проект прошлый год участник начать заниматься спорт самый сложный прошлый год суммарный расстояние который преодалеть участник км год число увеличиться участник узнать заниматься питер посетить воскресный двизать который самый разный кёрлинг скалодром бамперболл катание лыжа кавголово почему название пойти свой начало проект брать ещё март заканчиваться ровно час зазвучать сирена старт марафон отсюда браться название проект участие забег нереальный крутой бежать центр питер окружение бесча тный количество болельщик удар барабан должный попробовать каждый посмотреть подготовиться время марафон нереально рассказать студент мочь сделать лично ставить цель пробежать марафон поэтому каждый год ставить новый рекорд дистанция км хотеть поучаствовать вступать группа час лето внедрять спорт свой жизнь,245,[]
123,920,помнить разыгрывать подарок выпускник гуап самый креативный комплимент вуз прийти время подведение итог поздравлять победа аня сметанин дарья гладышев максим пронуть приз забрать написать личный сообщение группа друг дать обратный связь наш выпуск розыгрыш,34,"[('выпуск очень интересный информативный розыгрыш интересный приз круто возможность', 9)]"
124,916,наш проект гуап поколение набирать оборот далёкий большой стараться сделать круто качественно интересно отвечать опрос оставлять комментарий хотеть увидеть следующий выпуск,21,[]
125,912,уважаемый абитуриент завтра начинаться заключение договор обучение внесение данные заказчик личный кабинет подтверждение сторона гуап личный кабинет появиться реквизит договор сумма оплата данные производить оплата платёжный шлюз сбербанк лично касса университет типовой форма договор обучение мочь ознакомиться ссылка среднее день появление кабинет номер договор оригинал забрать приёмный комиссия важно подойти договор необходимо заказчик договор подписание прийти договор подписать сторона гуап договорный отдел распечатать ваш присутствие смочь подписать сторона заказчик обучаться оставить подписание сторона университет личный кабинет доступный реквизит договор необходимость получение скан присвоение номер договор написать запрос почта указание фио снилс,91,[]
126,910,гуап лицо сегодня познакомить полина высоцкий староста группа студентка первый курс институт радиотехник инфокоммуникационный технология видеоролик полина отвечать вопрос прийти роль староста почему староста круто наш герой злой добрый полицейский придерживаться политика кнут староста хотеть узнать полина справляться роль староста открывать видео активист гуап,44,"[('хороший', 1), ('наш мама', 2)]"
127,905,использовать свой шанс получить крутой подарок партнёр гуап андрей рудский выпускник гуап передать наш абитуриент подарок который хотеть разыграть условие простой нужно сделать репост наш выпуск гуап поколение страница поставить лайк пост видео оставить пост самый креативный комплимент гуап победитель выбрать комментарий случайный образ июль,45,"[('гуап поверить гуап гостеприимный университет который восхищать свой абитуриент поступить класс иметься куча секция понять маленький цифра общаться студент понять прекрасный преподаватель поэтому желать поступить сюда', 26), ('гуап место который помочь найти свой место общество учиться лучезарный отзывчивый дружелюбный студент помогать весь преподавать профессионал свой дело иметься огромный количество студия объединение большой саморазвитие нахождение новый знакомство', 29), ('ваш мама случайно екатерина второй почему вид развиваться', 8), ('гуап место твой мечта становиться реальность твой идея инновация гуап сокращение гениальный уникальный амбициозный прогрессивный', 15), ('гуап влюблять первый взгляд', 4)]"
