,id_поста,text_tokens,text_length,preprocessed_comments
271,458,дарить билет университет воскресение апрель корпус ул ленсовет пройти открытый мероприятие обучаться родитель билет университет час выпускник школа погрузиться атмосфера космический пространство гость организовать фото интерактивный зона каждый смочь почувствовать студент гуап представитель институт факультет ответить ваш вопрос помочь определиться направление подготовка инженерный школа гуап показать свой новый технический разработка отдел инженерный гараж гуап приходить увидеть вс свой глаз встречаться апрель адрес ул ленсовет забыть зарегистрироваться встреча гуап,68,"[('добрый день подсказать выпускник класс желать поступить спо прийти информация поступать класс', 12)]"
272,456,класс экономика право институт гуап пройти занятие бизин ольга старший преподаватель кафедра провести занятие тема теория поведение фирма затрата выручка прибыль обучаться объединиться команда порассуждать тема монополия углубить свой знание экономика,31,[]
273,455,опыт фдпо школа александр мельниченко декан фдпо гуап выступить качество эксперт всероссийский конференция международный участие информационный технология новый школа семинар цифровой пространство конвергентный образование приоритетный направление практика реализация декан поделиться хороший цифровой практика сфера конвергентный образование который реализоваться фдпо гуап ход открытый встреча площадка гбоу школа московский район санкт петербург поднимать вопрос потенциал цифровой трансформация тренд развитие конвергентный образование,59,[]
274,453,студент политехнический класс погрузиться мир когнитивный исследование лаборатория инженерный школа гуап обучаться политехнический класс посетить лаборатория когнитивный исследование инженерный школа гуап рамка экскурсия ребята получить уникальный возможность ознакомиться оборудование лаборатория принцип работа нейроинтерфейс миографический датчик носить стационарный айтрекер экскурсия школьник узнать технология помогать изучать работа человеческий мозг создавать нейроаватар участник программа увидеть работать нейроинтерфейс который позволять передавать сигнал мозг компьютер использовать сигнал управление различный устройство помощь миографический датчик студент узнать измерять электрический активность мышца использовать информация изучение движение человек познакомиться носить стационарный айтрекер который позволять измерять движение глаз использовать информация изучение внимание память ход экскурсия студент показать текущий разработка лаборатория позволить увидеть возможность предоставляться исследование область когнитивный наука,108,[]
275,452,мастер класс лаборатория робототехника инженерный школа гуап обучаться итш г мариуполь инженерный технологический школа город мариуполь состояться мастер класс инженер лаборатория робототехника инженерный школа гуап филимонов сергей мастеров андрей мероприятие организовать совместно компания мгбот технологический партн ром лаборатория приурочить изучение интернет вещь робототехника участник мастер класс получить теоретический знание практический навык работа микроконтроллер база семейство йотик инженер лаборатория рассказать ребята принцип построение система интернет вещь продемонстрировать подключение различный датчик мероприятие стать отличный возможность развитие свой технический потенциал знакомство новый технология организатор выразить надежда подобный мастер класс помочь заинтересовать молодой поколение сфера робототехника интернет вещь,94,[]
276,451,биотехнический система технология юриспруденция помочь определиться выбор профессия день открытый дверь гуап апрель онлайн апрель офлайн ул ленсвет далее рамка мероприятие выступить представитель факультет институт представитель приёмный комиссия амбассадор университет смочь узнать подробность реализовать программа обучение получить ответ интересовать вопрос участие заполнять форма жд м гуап,46,"[('добрый день нужно взять мероприятие паспорт др документ', 8)]"
277,447,ловить хвост свой последний шанс принять участие аэрокосмический олимпиада апрель ул ленсовет далее пройти аэрокосмический олимпиада математика вход участник осуществляться приглашать онлайн консультация математик консультация проводиться весь желать познакомиться олимпиада подготовиться успешный прохождение следующий учебный год заполнять форма подключаться аэрокосмический олимпиада включить перечень олимпиада министерство просвещение рф приказ проводиться каждый год следующий тур аэрокосмический олимпиада начаться декабрь участие олимпиада возможность получить дополнительный балл поступление участник олимпиада получить балл индивидуальный достижение приз ры победитель смочь получить балл соответственно балл олимпиада разный предмет суммироваться,82,"[('результат очный тур информатика физика', 5)]"
278,446,инженер лаборатория искусственный интеллект алексей якушев провести лекция участник политехнический класс инженерный школа гуап развитие применение искусственный интеллект особый внимание уделить ия электроэнергетика применяться распределение энергия создание цифровой двойник энергетический объект рамка лекция рассмотреть основной сфера область применение искусственный интеллект связь технология индустрия участник узнать почему искусственный интеллект важный энергетический сектор мочь помочь повышение эффективность работа энергетический объект практический часть мероприятие участник обучить нейросеть помощь платформа классификация изображение распознавание дефект материал ребята научиться создавать архитектура нейронный сеть использование код помощь специальный блок,82,[]
279,444,день открытый дверь гуап ученик лицей калининский район прош л день открытый дверь ученик лицей калининский район планировать продолжить обучение институт фундаментальный подготовка технологический инновация гуап учиться посетить лаборатория межфакультетский лаборатория экология техносферный безопасность лаборатория цифровой метрология лаборатория аддитивный производство виртуальный реальность школьник выступить студент различный направление рассказать студент гуап вести настоящий научный работа лаборатория направление который познакомиться ребята управление качество стандартизация метрология инноватик природообустройство водопользование биотехнология прикладной математик информатика прикладной информатика прикладной математик физика жд м учиться школа начало компания гуап год,83,[]
280,439,гимназист гуап учиться класс корпус гимназия земля вселенная посетить экскурсия лаборатория факультет среднее профессиональный образование гуап познакомиться основный технический специальность авиационный прибор комплекс электрический машина аппарат мехатроника мобильный робототехника отрасль обучаться узнать особенность профессия ознакомиться специальный тренажёр мехатроника настоящий учебный проект который реализоваться студент гуап ребята подробно рассказать специфика процесс обучение правило поступление факультет факультет спо гуап год,58,[]
281,438,напоминать заключительный тур аэрокосмический олимпиада заключительный тур пройти адрес ул ленсовет далее график проведение олимпиада апрель аэрокосмический олимпиада физика апрель аэрокосмический олимпиада математика вход участник осуществляться приглашать онлайн консультация физика математик консультация проводиться весь желать познакомиться олимпиада подготовиться успешный прохождение следующий учебный год заполнять форма подключаться аэрокосмический олимпиада включить перечень олимпиада министерство просвещение рф приказ проводиться каждый год следующий тур аэрокосмический олимпиада начаться декабрь участие олимпиада возможность получить дополнительный балл поступление участник олимпиада получить балл индивидуальный достижение приз ры победитель смочь получить балл соответственно балл олимпиада разный предмет суммироваться,89,[]
282,435,госкорпорация роскосмос приглашать посетить день абитуриент роскосмос мероприятие пройти март адрес г москва проспект мир павильон центр космонавтика авиация участие приглашаться учиться космический класс школьник планировать связать сво профессиональный будущее ракетный космический отрасль родитель день абитуриент смочь услышать выступление спикер ракетный космический отрасль познакомиться представитель опорный вуз входящий консорциум созвездие роскосмос вуз партнёр узнать программа обучение специальность получить консультация вопрос поступление образовательный учреждение получить представление возможность заключение целевой договор предприятие госкорпорация роскосмос узнать большой деятельность ракетный космический отрасль посетить интерактивный площадка принять участие мастер класс участие профориентационный акция абитуриент родитель необходимо пройти регистрация подходящий время начало начало начало,98,[]
283,430,актовый зал школа состояться открытие который директор виноградов вероника рассказать школьник важность выбор направление подготовка знакомство университет руководитель кафедра директор институт аэрокосмический прибор система майоров николай познакомить школьник история лиап гуап основный исторический событие университет представить вклад гуап космический отрасль представить направление подготовка современный компетенция институт представить проект космический класс гк роскосмос заместитель директор институт кузнецов надежда рассказать направление подготовка правило поступление гуап год нововведение олимпиада рассказать интересный насыщенный масса научный общественный культурный мероприятие жизнь студент институт визионерский лекторий принять участие школьник время первый часть лекторий школьник выбирать кафедра направление подготовка который вызвать интерес второй часть мероприятие отдельный презентация весь направление кафедра институт аэрокосмический прибор система гуап презентация направление бакалавриат специалитет выполнить заместитель заведовать кафедра кандидат технический наука доцент кафедра аэрокосмический измерительный вычислительный комплекс перлюк владимир профессор кафедра системный анализ логистика майоров николай ассистент кафедра системный анализ логистика костин антон инженер кафедра эксплуатация управление аэрокосмический система комаров любовь инженер кафедра эксплуатация управление аэрокосмический система иванов михаил заведовать кафедра аэрокосмический компьютерный программный система доцент кандидат техничего ких наука оленеть валентин школьник представить презентация весь направление подготовка рассказать ключевой компетенция представить последний исследовательский технологический проект кафедра,184,"[('очень полезный мероприятие', 3)]"
284,428,аэрокосмический олимпиада гуап консультация олимпиада поздравлять весь пройти второй тур аэрокосмический олимпиада заключительный тур пройти адрес ул ленсовет далее график проведение олимпиада март аэрокосмический олимпиада информатика апрель аэрокосмический олимпиада физика апрель аэрокосмический олимпиада математика весь хотеть познакомиться олимпиада приглашать онлайн консультация информатика физика математик заполнять форма подключаться участие олимпиада возможность получить дополнительный балл поступление участник олимпиада получить балл индивидуальный достижение приз ры победитель смочь получить балл соответственно балл олимпиада разный предмет суммироваться желать успех заключительный тур получиться поучаствовать олимпиада пройти заключительный тур год мочь попробовать свой сила следующий аэрокосмический олимпиада включить перечень олимпиада министерство просвещение рф приказ проводиться каждый год,100,"[('подсказать известный результат олимпиада информатика', 5)]"
285,410,март приглашать присоединиться трансляция онлайн день открытый дверь гуап подключаться вконтакте ждать будущий абитуриент родитель встреча смочь познакомиться направление обучение университет задать интересовать вопрос специалист приёмный комиссия представитель институт факультет жд м весь выбирать вуз поступление,36,"[('очень тихо слышный', 3), ('день открытый дверь гуапе', 4), ('добрый день очный день открытый дверь состояться март ждать', 9), ('н', 1), ('день открытый дверь регистрироваться', 4), ('подъехать время', 2), ('средний балл егэ факультет электроэнергетика электротехника', 6), ('узнать дата проведение финал олимпиада информатика', 6), ('добрый день апрель встреча представитель спо', 6)]"
286,407,отправляться космос март день открытый дверь гуап состояться март адрес санкт петербург ул ленсовет далее сбор гость начинаться рассказать направление обучение наш университет правило приём необходимый экзамен полезный поступление информация регистрация встреча первый аэрокосмический,34,[]
