,id_поста,text_tokens,text_length,preprocessed_comments
0,1531,регистрация вс сегодня заканчиваться регистрация проект код будущее гуап твой шанс стать первоклассный специалист ещ вс потерять успевать регистрироваться,19,[]
1,1529,экспресс тест восприятие цвет готовый узнать большой писать комментарий получиться,10,"[('', 0)]"
2,1528,,0,[]
3,1527,остаться день весь день ост тся закрытие регистрация участник проект код будущее гуап оставлять дело твой шанс стать первоклассный специалист бесплатный курс программа код будущее дать практический теоретический навык программирование обучить нуль популярный язык программирование предоставить возможность поучаствовать хакатон помочь создать собственный портфолио дать балл егэ поступление первый аэрокосмический торопиться регистрация скоро закрываться,53,[]
4,1518,открыть секрет первый аэрокосмический еженедельный прямой эфир стартовать сентябрь директор институт технология предпринимательство право артур суренович рассказать актуальный информация поступление гуап год подключаться спрашивать разбираться вместе,26,[]
5,1503,знакомство первый аэрокосмический режим онлайн октябрь мск пройти первый учебный год день открытый дверь гуап онлайн формат будущий абитуриент родитель жд презентация университет образовательный программа выступление представитель комиссия гуап ответ вопрос режим онлайн жд м вк стать близкий зв здать вместе гуап,42,[]
6,1500,незабываемый пройти первый учебный год день открытый дверь гуап рада видеть каждый надеяться день вопрос остаться слово давать посмотреть пройти день листать карусель смочь прийти нетерпение жд м день открытый дверь онлайн формат который состояться октябрь н м рассказать поздний встреча первый аэрокосмический,43,[]
7,1498,амбассадор дело недавно представитель первый аэрокосмический начать проводить тематический урок школа читать поступать гуап,14,[]
8,1496,талантливый студент талантливый вс м недавно рука попасть очень интересный монолог студент первый аэрокосмический давать вместе послушать монолог ала ны увидеть удивительный мир студент изнутри привет звать титов ала студентка третий курс факультет спо специальность авиационный прибор комплекс студенческий жизнь проходить очень ярко являться участник волонт ром чемпионат профессионал компетенция инженерия космический система состоять студенческий совет факультет качество редактор свободный время заниматься споттинг фотографирование самол тов построение беспилотник летать флайтсимулятор играть скрипка фортепиано гитара часто ходить театр ранний возраст интересовать авиация привлекать величественный вид блестящий огромный птица самол тов смотреть небо слышать рассказывать весь лететь безумно нравиться вс глубокий глубокий узнавать строение самол тов изнутри отвечать вопрос летать самол пилот контролировать параметр почему самол падать почва общий интерес колледж познакомиться прекрасный человек который общаться каждый день обсуждать новость авиасообщетсв вместе ездить споттить разделять друг друг ежедневный радость представлять свой жизнь авиация прекрасный друг поддерживать очень нела гкома путь небо пол,150,[]
9,1494,остаться день завтра сентябрь состояться долгожданный день открытый дверь первый аэрокосмический приходить адрес ул ленсовет далее пропустить погрузиться мир космос голова регистрация начало официальный часть советовать прийти ранний точно успеть начало,31,[]
10,1492,нейростудент нейросеть способный мочь генерировать картинка ваш запрос спросить нейросеть видеть студент первый аэрокосмический показать писать комментарий ещ спросить нейросеть обязательно показать,22,[]
11,1476,студент программист программирование изнутри сегодня познакомиться александр звездаков студент третий курс институт информационный технология программирование александр ранний год войти мир стать программист разрабатывать очень интересный приложение который скоро рассказать читать интервью погружаться мир совершенно бесплатно,35,"[('', 0), ('хороший мальчик', 2), ('урааа красотища', 2), ('человек помогать сдаваться', 3), ('саня лучшиииия саня лав', 4), ('автограф крутой', 2), ('кризис год узнать динамический типизация', 5)]"
12,1474,абитуриент первокурсник пройти неделя уч смотреть поступить давать узнать поточный голосовать опрос поступить планировать поступить ещё определиться институт писать комментарий код специальность который хотеть поступить,25,[]
13,1470,хотеть погрузиться мир космос скоро состояться первый учебный год день открытый дверь гуап пока готовиться встреча давать вспомнить пройти день открытый дверь прошлый год листать карусель наслаждаться забывать сентябрь жд м корпус ул ленсовет далее знакомство первый аэрокосмический приходить,39,[]
14,1468,очередной дайджест будущий аспирант гуап важный дата очередной неделя сентябрь конкурсный список бюджетный место квота сентябрь крайний срок сдача оригинал документ образование поступление рамка квотный место сентябрь приказ зачисление квотный место сентябрь крайний срок сдача документ образование поступление бюджет сентябрь приказ зачисление бюджет сентябрь конкурсный список контрактный место сохранять поступать первый аэрокосмический,52,[]
15,1464,амбасадор гуап дело работа кипеть наш амбасадор успеть побывать школа санкт петербург недавно александр звездаков смочь побывать школа провести профориетационный урок александр рассказать школьник первый аэрокосмический студенческий жизнь поступление проект код будущее гуап суммарно смочь послушать человек школьник поблагодарить помощь выбор вуз свой будущее,44,[]
16,1460,продолжать рассказывать наш первокурсник впечатление начало учёба гуап сегодня знакомиться екатерина кисель первокурсница институт выпускница факультет среднее профессиональный образование гуап катя рассказать свой впечатление день знание фестиваль объединение катя линейка гуап год год новый интересный весь стаж нахождение гуап назвать видеть линейка год день знание новый непривычный формат сцена стоять друг место фестиваль объединение невероятный задумка ребята начало учебный год смочь окунаться гуап большой попробовать направление разный студия почему выбрать институт технология предпринимательство право зацепить катя год соцсеть подписаться аккаунт институт определить выбор будущий год студентка наш замечательный университет поделиться напутствие первокурсник абитуриент катя первокурсник повторить фраза куратор факультет спо который озвучить сентябрь поработать первый семестр свой авторитет авторитет начать работать абитуриент год поступать гуап очень классно заметить пролететь ваш год уч,122,"[('легенда', 1), ('', 0)]"
17,1456,казаться недавно сентябрь пройти неделя уч воспоминание остаться давать послушать наш первокурсник войти свой студенчество эмоция испытывать привет звать откуда поступить привет звать андрей санкт петербург поступить специальность реклама факультет настроение праздник эмоция испытывать настроение отличный праздник весёлый радостный эмоция новый знакомство новый обстановка изучить свой расписание предмет интересовать большой весь расписание успеть изучить очень интересовать предмет введение специальность познакомиться студент бывший одноклассник который учиться вместе успеть завести новый знакомство каков твой ожидание учёба студенческий жизнь ожидание пока новый обстановка знать ожидать уверенный очень интересно увлекательно собираться организовывать свой время первый дело уч распределять задача важный менее важный вс успевать цель ставить учебный год постичь новый учебный обстановка учиться планировать делать внеучебный время изучать учебный программа мочь заняться ещё пока знать план будущее повод твой профессия карьера пока крупный план строить итог собираться работать профессия собираться участвовать социальный жизнь вуз записываться кружка студия хотеть вступить студенческий совет факультет остальной кружок ещё смотреть думать заинтересовать навык обладать который помочь учебный процесс коммуникабельность умение договариваться опыт работа медиа сфера первокурсник рассказать писать личный сообщение группа,173,"[('факультет', 1), ('кст парень', 2)]"
18,1453,ректор гуап юлия антохин прямой эфир радио санкт петербург высокий школа должный заниматься фундаментальный наука подготовка кадр юлия антохин поделиться слушатель успех вуз рассказать специалист готовить гуап уникальный статус исследовательский университет вовлечение молодёжь аэрокосмический приборостроение высокий школа должный заниматься фундаментальный наука подготовка кадр наш вуз разработка гуап славиться исследование прикладной характер любой научно исследовательский опытно конструкторский работа стремиться масштабировать студент создать возможность поделиться прямой эфир ректор гуап юлия антохин рассказать работодатель испытывать кадровый голод партнёр гуап тысяча предприятие нуждаться квалифицировать специалист обучаться важно уметь работать команда слово ректор студент впоследствии выпускник успешно вливаться коллектив становиться наполнить специалист авторитет сво м направление ректор первый аэрокосмический убедить любой человек должный учиться протяжение весь жизнь технология стремительно меняться поэтому важно адаптироваться новый направление ректор гуап рассказать реализовать университет проект цифровой кафедра возможность получить второй профессия дополнительный образование подчеркнуть выпускник трудоустраиваться выпуск работать специальность тема беспилотник высказаться ясно тематика актуальный давно гуап заниматься беспилотный летательный аппарат год создать полноценный образовательный программа связать беспилотие авиация космос часть образовательный трек иметь спрос завершение прямой эфир ректор гуап пожелать студент целеустремл нный креативный осознанно подходить деятельность который заниматься,181,[]
19,1449,день программист сентябрь россия праздноваться день программист почему сентябрь дата являться дн м год очевидный число являться практически священный язык программирование максимально возможный число элемент любой система битный кодирование символизировать двоичный система счисление количество битов байт самый высокий значение степень число который получаться число маленький день год долгий время наш страна принять дата апрель цифровой способ написание дата код специальность программный обеспечение вычислительный техника общероссийский классификатор код устареть некоторый время назад заменить поздравлять весь причастный приглашать стать часть праздник поучаствовать программа код будущее гуап регистрироваться познавать мир совершенно бесплатно,89,[]
20,1446,момент начало кампания год гуап поступить тысяча заявление абитуриент казаться новый рекорд примерно расстояние преодолевать наш планета земля менее минута хотеть узнать большой интересный факт кампания год писать комментарий,29,"[('количество специальность выбрать поступление', 4)]"
21,1444,будущий аспирант очередной дайджест специально предстоящий дата неделя сентябрь завершение ма документ рамка контрактный место сентябрь завершение вступительный испытание весь форма обучение ещ успеть подать документ смело подавать погружаться голова наука вместе гуап,33,[]
22,1442,большой уч гуап начаться аспирант ещ поступать школьник весь готовиться экзамен давать посмотреть сколько поступить предстоять поступить вуз мечта смело голосовать опрос готовиться поступление писать специальность планировать поступать будущее год,30,[]
23,1441,подготовительный курс гуап снова открывать набор начать готовиться блестящий завершение учебный год переход следующий ступень образование старт занятие октябрь год предмет математик физика информатика русский язык подробный информация зачисление курс производиться основание бесплатный тестирование определение уровень знание сентябрь открыться запись почта весь вопрос обращаться вконтакте телефон пн пт,48,[]
24,1439,москва камчатка недавно пройти онлайн конференция посвящий нный проект код будущее гуап декан фдпо александр мельниченко ответить вопрос образовательный учреждение ведущий преподаватель проект презентовать свой обучать программа интерес представитель школа техникум колледж оказаться очень высокий образовательный учреждение весь россия москва камчатка присутствовать онлайн задавать важный вопрос процесс взаимодействие вуз школа спо выстроить максимально эффективно смочь подключиться прямой эфир планировать посмотреть трансляция запись ключевой мысль явиться гуап открыть сотрудничество готовый предоставить современный знание обширный практика область информационный технология юный специалист образовательный учреждение свой сторона заинтересовать учиться реализовать уникальный возможность обучение высокий школа самый востребовать современный направление запись программа бесплатный обучение,99,[]
25,1437,метрологический класс гуап большой возможность школьник уважаемый представитель ученик школа рада сообщить первый аэрокосмический запускать профильный класс институт факультет учиться школа профильный класс уникальный возможность школьник окунуться атмосфера настоящий студенческий жизнь получить новый навык знание работать лаборатория университет сентябрь свой дверь школьник открыть институт фундаментальный подготовка технологический инновация фптить гуап преподаватель институт приглашать учиться класс метрологический класс рамка класс ребята узнавать общий понятие метрология наука профессия перспектива развитие дать сфера деятельность основный цель функция инженер метролог итог прохождение обучение каждый школьник получить сертификат занятие проходить очно главный корпус гуап адрес ул больший морской далее расписание метрологический класс экскурсия вуз аудитория метрологический оборудование вводный лекция основа метрология занятие лаборатория стандартизация сертификация метрология занятие лаборатория цифровой метрология введение цифровой метрология круглый стол доклад участник оставить заявка участие метрологический класс ссылка заявка приниматься сентябрь включительно записываться развиваться вместе первый аэрокосмический,137,[]
