,id_поста,text_tokens,text_length,preprocessed_comments
183,705,военный образование гражданский вуз сегодня речь пойти военный учебный центр гуап который реализовать подготовка офицер солдат запас военный кафедра военный учебный центр вуц создать сентябрь год состав входить кафедра который осуществлять подготовка кадровый офицер офицер солдат запас возглавлять военный учебный центр поч тный работник высокий профессиональный образование рф полковник скуратов вадим вячеславович самый часто задавать вопрос абитуриент вуз военный кафедра поступление военный кафедра второй семестр обучение начинаться программа поступление состоять подача заявление прохождение медицинский комиссия сдача норматив фп успешный зачисление военный кафедра начинаться обучение который длиться й й год обучение параллельный обучение гражданский специальность день неделя выделяться военный дело год обучение военный кафедра студент лето выезжать месяц сбор войсковой часть выпуск получать диплом вместе военный билет заходить официальный страница вуц узнавать большой возникать вопрос задавать личный сообщение группа беседа абитуриент гуап,131,[]
184,702,путешествие мир поступление продолжать делиться проходить процесс поступление абитуриент читать карточка узнавать история серафим выбор университет возникать проблема выбор вопрос задавать личный сообщение группа беседа поступать гуап,27,[]
185,697,выпускник гуап проведа алый парус дмитрий хрусталёв выпускник санкт петербургский государственный университет аэрокосмический приборостроение стать ведущий масштабный выпускной страна который показать эфир пятый канал вместе ида галич поздравить ещё вчерашний школьник сцена дворцовый площадь июнь дмитрий хрусталёв российский актёр шоумен проводить ребята взрослый жизнь событие пройти открытый небо сотня тысяча зритель гуап гордиться свой выдавать выпускник,56,[]
186,695,начало положить привет абитуриент вчера состояться открытие приёмный кампания связь возникнуть вопрос обстоять дело поступление,15,[]
187,694,,0,[]
188,692,обстоять дело абитуриент гуап знать поступать очень непростой время открыть диалог готовый помочь любой ситуация давать послушать обстоять дело наш абитуриент посетить наш мный комиссия смотреть видео рассказывать комментарий выбирать вуз возникать вопрос писать личный сообщение группа беседа абитуриент,39,[]
189,684,балл поднять рейтинг поступать помочь дополнительный балл индивидуальный достижение хотеть узнать увеличить поступление бакалавриат специалитет читать критерий балл участник сертификат участник олимпиада школьник балл участие диктант победа наличие итоговый сочинение являться условие допуск государственный итоговый аттестация образовательный программа среднее общий образование зачёт балл наличие статус чемпион призёр олимпийский игра паралимпийский игра сурдлимпийский игра чемпион мир чемпион европа лицо занять первый место первенство мир первенство европа вид спорт включить программа олимпийский игра паралимпийский игра сурдлимпийский игра наличие золотой серебряный бронзовый значок гто призёр диплом степень олимпиада школьник балл наличие документ образование отличие победа диплом степень олимпиада школьник наличие статус победитель призёр национальный международный чемпионат профессиональный мастерство инвалид лицо ограниченный возможность здоровье абилимпикс ознакомление полный список индивидуальный достижение поступление переходить ссылка,119,"[('волонт рство', 2)]"
190,683,летний школа гуап летний школа отличный возможность школьник провести время польза качественно поднять уровень знание профилировать предмет математик физика информатика занятие проходить онлайн формат срок обучение месяц июль август специально учиться курс провести экскурсия различный корпус лаборатория университет научно исследовательский комплекс гуап оставить заявка обучение летний школа гуап портал электронный почта подготовительный курс гуап заявка приниматься июнь подробный,58,[]
191,682,красота спорт интеллект мисс мистер гуап сегодня хотеть поделиться самый красивый элегантный мероприятие наш вуз помочь координатор проект дарья константинов прочтение интервью обязательно бежать смотреть видеоролик проникнуться атмосфера сподвигнуть попробовать роль организатор масштабный проект идея привлечь сразу ещё первый курс осознать полностью понять оценить сложность важность организация проект мисс мистер нужно пройти самостоятельно качество участник позволить получить ценный опыт глубокий понимание внутренний работа проект перейти второй курс готовый взять активный роль присоединиться команда организатор открыться возможность применить накопить знание опыт поработать непосредственно участник проект каждый год мо участие проект становиться ценный ответственный страх твой ожидание оправдаться страх присутствовать особенно нужно делать неожиданный спонтанный решение трудно принять новость становиться координатор проект половина проект пройти далёкий ответственность действие решение проект нести довольный финал проект гордиться участник вложиться проект гордиться свой команда который работать высокий уровень суметь слаженно работать поддерживать друг друг быстро решать возникать вопрос проблема рассказать представлять данный проект проект мисс мистер гуап проводиться ежегодно студент вуз время весенний семестр главный цель выявить наиболее талантливый разносторонний развитой участник обладать интеллектуальный спортивный творческий способность проект включать отборочный этап который определяться финалист проект поделиться самый яркий момент проект самый захватывать момент весь проект являться финал участник демонстрировать свой талант команда организатор проявлять свой мастерство вместе работать создание завершать шоу каждый переживать результат самый тревожный момент объявление победитель участник заслуживать победа организатор вкладывать частичка свой душа каждый урок извлечь организатор самый ценный урок который извлечь заключаться нужно бояться задавать вопрос просить помощь невозможно знать уметь рядом человек иметь большой знание опыт готовый дать ценный совет помочь,252,[]
192,680,дата настать июнь дата начало ма документ первый аэрокосмический доступный направление подготовка сегодня мный комиссия гуап начало свой работа полный мощность определиться перспективный будущее дорога мный комиссия гуап открыть очный приём документ проходить адрес ул якубович далее будний день контакт комиссия адрес электронный почта телефон жд м комиссия вопрос писать личный сообщение группа беседа абитуриент,55,[]
193,675,рассказывать особый право поступление гуап существовать вид квота целевой квота особый квота отдельный квота целевой квота квота приём рамка отдельный конкурс место выделить рамка контрольный цифра приём приём место рамка квота целевой приём осуществляться основа договор целевой обучение заключить гражданин поступать обучение орган организация указанный статья фз образование российский федерация особый квота квота приём обучение программа бакалавриат специалитет счёт бюджетный ассигнование федеральный бюджет лицо иметь особый право приём предел квота особый право обладать ребёнок инвалид инвалид группа инвалид детство инвалид военный травма заболевание получить период прохождение военный служба ребёнок сирота ребёнок остаться попечение родитель лицо число ребёнок сирота ребёнок остаться попечение родитель ветеран боевой действие число лицо указанный подпункт пункт статья федеральный закон январь г фз ветеран отдельный квота квота приём обучение программа бакалавриат специалитет счёт бюджетный ассигнование ребёнок военнослужащий сотрудник участвовать специальный военный операция герой российский федерация лицо наградить орден мужество рамка квота мочь поступать гражданин рф дать квота иметь статус абитуриент соответственно разный право ребёнок военнослужащий сотрудник участвовать специальный операция приниматься результат ви мочь использовать результат егэ егэ ви мочь выбрать хороший результат ребёнок военнослужащий сотрудник погибнуть получить увечье заболевание ход специальный операция герой российский федерация лицо наградить орден мужество приниматься проведение вступительный испытание остаться вопрос писать личный сообщение группа беседа поступать,204,[]
194,672,хотеть иметь собственный спутник поступать гуап рассказывать проект спутник гуап год проект спутник запускаться юбилейный год подряд коротко создать адаптация новоиспечий нный студент первокурсник стена вуз начало учебный процесс каждый учебный группа закрепл н человек который называться спутник первокурсник познакомиться ещё конец август первый шаг адаптация вместе пройти нога нога определ нный этап жизнь первокурсник основной задача спутник сплочение группа погружение университетский жизнь помощь поиск деятельность вуз постановка медицинский воинский уч получение пропуск бск заселение общежитие помощь абсолютно любой вопрос слово человек который помочь абсолютно любой ситуация выслушать сориентировать направить правильный путь хотеть познакомиться свой спутник писать свой ожидание комментарий воплотить жизнь остаться вопрос задавать личный сообщение группа беседа абитуриент,110,[]
195,670,институт факультет гуап сегодня речь пойти институт фундаментальный подготовка технологический инновация институт обеспечивать фундаментальный подготовка физика математика механика управление качество техносферный безопасность метрология многий направление отличительный особенность институт фптить тесный связь фундаментальный подготовка область математика физика специализировать подготовка ориентация решение актуальный проблема создание новый техника технология институт иметь кафедра базовый кафедра стандартизация сертификация качество наукий мкий производство учебный год институт реализовать направление бакалавриат специалитет направление магистратура организовать профбюро фптить студенческий совет фптить заглянуть хотеть увидеть жить студент хотеть узнать большой институт заходить официальный страница остаться вопрос писать личный сообщение группа беседа поступать,92,"[('уважаемый поступать заинтересовать институт фптить писать лс ответственный м бакалавриат специалитет александр валериевич', 13)]"
196,668,обстоять дело абитуриент амбассадор гуап учебный год поработать слава продолжать собирать обратный связь заодно узный м обстоять дело выбор вуз будущий школьник читать карточка узнавать история егор процесс выбор университет возникать проблема выбор вопрос задавать личный сообщение группа беседа поступать гуап,41,[]
197,667,возможность творчество гуап сегодня поговорить творческий составлять жизнь студент гуап творческий студия который видеостудия фотостудия музгуап квн гуап театральный студия пресс центр крыло гуап танцевальный студия радио гуап студия организация мероприятие студия технический обеспечение мероприятие студия ведущий группа поддержка действительно творчество развитой самый главное помогать отвлечься рутинный учебный будни освободить мысль продолжение продуктивный интеллектуальный деятельность уверить успеть отметить понравиться объединение писать комментарий студия посетить первый дело остаться вопрос задавать личный сообщение группа беседа абитуриент,74,[]
198,666,рассказывать разработка гуап сегодня речь пойда оптический датчик обнаружение возгорание разработать инженер гуап данный изобретение опережать подобный устройство скорость выявление очаг пожар чувствительность обычный противопожарный система подавать сигнал тревога среднее секунда возгорание прибор создать наш учёный секунда быстрый датчик срабатывать температура превышать аналог давать сигнал тревога время мочь хватить предотвращение распространение пламя лазерный система обнаружение тепловой поток который разработать использовать взрывоопасный производство наш пожарный датчик являться линейный рассчитать больший дальность порядок м контроль протяжённый помещение рассказать разработчик прибор студентка гуап ян рывкина работа устройство основать оптический принцип источник лазер направляться луч который фиксировать степень преломление воздух показатель меняться повышение температура задымление помогать фиксировать пожар необходимость регулировать протяжённость луч поэтому разработка адаптировать любой помещение хотеть учиться изобретать жить поступать гуап вопрос поторопиться задать личный сообщение группа чат поступать гуап,128,[]
199,665,институт факультет гуап сегодня речь пойти гуманитарный факультет факультет гуманитарный факультет место учиться работать множество заинтересованный талантливый студент преподаватель факультет получить высокий образование направление культурология лингвистика гостиничный дело реклама студент предоставляться отличный возможность саморазвитие расширение кругозор открытие новый область главный принцип обучение факультет инновационность востребованность знание получать студент особый методика преподавание который следовать факультет выпускник гуап отличаться глубокий знание мочь успешно применять практика особо стоить отметить научный деятельность факультет преподаватель студент активно вовлечь различный исследовательский проект проводить сессия участвовать конференция разный уровень результат получать уникальный опыт доступный далеко весь студенческий сообщество регулярно проводиться разный мероприятие научный семинар культурно просветительский программа поддержать обогатить академический социальный жизнь студент образ гуманитарный факультет прекрасный место хотеть получить качественный образование совмещать академический подход практический применимость знание изучить список реализовать направление подготовка мочь ссылка остаться вопрос задавать личный сообщение группа беседа абитуриент гуап,137,"[('', 0)]"
