,text_tokens,text_length
214,скоро присоединиться наш большой команда который называть знать волнительный момент точно куча вопрос август телеграм стартовать марафон узнать вс самый важный присоединяться дерзать творить делать,25
215,мегастудент приказ зачисление поздравлять приветствовать скоро рассказать получить доступ информационный система университет адаптер помочь поступить контракт август,17
216,рассказывать новый сервис подбор арендный жильё обучаться итмый льготный цена ещё видеть переходить ссылка знакомиться хотеть хороший спланировать работа сервис поэтому просить ответить несколько вопрос личный кабинет абитуриент информация данный опрос влиять порядок расселение помочь стать удобный переходить лк заполнить анкета анкета абитуриент общежитие,44
217,приказ,1
218,добрый день дата ориентироваться заселение студент обучаться платный основа,9
219,каждый год итмый раста количество иногородний студент отдавать предпочтение аренда квартира комната поселение общежитие поэтому год университет запускать сервис подбор арендный жильё обучаться итмый льготный цена основной принцип работа сервис верификация университет проверять добросовестность компания предоставлять жильё аренда исключить риск обман мошенничество удобство жильё находиться поблизости корпус университет метро компания предоставлять жильё оформлять временной регистрация коливинга место проживание концентрироваться сообщество студент итмый экономия счёт повышение заполняемость снижение издержка реклама компания предоставлять жильё снижать стоимость проживание компания учитывать финансовый возможность студент готовый рассматривать разный возможность заселение человек комната стоимость тысяча человек переходить знакомиться,92
220,финал завершить приём согласие оригинал образовательный программа бакалавриат университет итмый большой бюджет год поступить приёмный комиссия время выдохнуть проверить дело скоро узнать имя новый студент итмый поздравить ждать приказ август документ контрактный форма обучение подать август,36
221,добрый день доходный дом студент заселение,6
222,подсказать число начаться заселение общежитие иногородний студент необходимо купить заранее билет,11
223,подсказать отдать аттестат бви зачислить захотеть забрать аттестат август пк быстро отдать,12
224,список рекомендовать отметить жёлтый цвет знак подать оригинал согласие стать студент итмый подавать оригинал согласие мск август отметить цвет очень хотеть связаться ответственный факультет узнать свой шанс встречаться итмый,29
225,первый приказ контракт второй приказ контракт близко искать поздравлять весь стать часть университет итмый напоминать заявление согласие оригинал общий конкурс приниматься мск август список рекомендовать уйти отдохнуть вскоре вновь вернуться порадовать абитуриент итмый,33
226,первый приказ зачисление год поступить вступительный испытание предел особый квота предел целевой квота предел специальный квота приказ ссылка поступать общий конкурс ещё время загрузить свой согласие личный кабинет подать оригинал приёмный комиссия стать студент первый неклассический смотреть список рекомендовать,39
227,подавать заявление госуслуга балл индивидуальный достижение поставить звонить приёмный комиссия сказать вс исправить исправить звонить сегодня сказать исправить мочь выглядеть очень подозрительно,22
228,добрый утро сказать число необходимо предоставить оригинал документ поступление контракт каков последовательность действие подача заявка,15
229,добрый день подсказать разместить приказ зачисление бви,7
230,балл примерно нужный получить общежитие поступление,6
231,список рекомендовать ждать рекомендовать зачисление выделить жёлтый цвет самый время загрузить заявление согласие зачисление подать оригинал документ образование рекомендовать зачисление выделить зел ным цвет студент университет итмый ждать приказ зачисление встреча итмый,32
232,весь привет список рекомендовать зачисление,5
233,список,1
234,добрый день подсказать сколько опубликовать приказ зачисление,7
235,сегодня последний день подача согласие аттестат зачисление бви документ приниматься мск приёмный комиссия итмый кронверкский пр далее,17
236,добрый утро список рекомендовать зачисление список правило ма вуз срок размещение дать информация,13
237,приём документ бакалавриат итмый завершить ждать список рекомендовать отправлять согласие зачисление рекомендовать точно стать студент итмый,16
238,поступать бакалавриат информационный система технология условие поступление бви место количество поступать бви большой происходить зачисление случай,16
239,внимание внимание сегодня последний день завести дело приёмный комиссия университет итмый год сегодня последний день мочь подать заявление завести дело поменять приоритет добавить новый заявление программа бакалавриат мск дать функция закрыться июль подача согласие оригинал бви квота август подача согласие оригинал егэ ида подавать пока ещё время,47
240,стипендия рубль месяц возможность получить свой счастливый студенческий билет егэ диплом победитель призёр олимпиада рсош всош поступать бви стипендия специально подача документ университет итмый июль,25
241,остаться маленький неделя конец приём документ университет итмый простой шаг путь итмый переходить ссылка подавать документ следить список поступать хотеть учиться бесплатно хватать балл поступить участвовать конкурс уникальный достижение абитуриент подробный документ приниматься мск июль,35
242,начинать день открытый дверь итмый основной момент поступление бакалавриат год стипендия вопрос абитуриент подключаться задавать свой вопрос комментарий трансляция ответить прямой эфир,22
243,новый выпуск наш серия ролик направление итмый очередь инженерия студент создать настоящий экзоскелет робот художник продавать токен петербург делать беспилотный автомобиль ответить вопрос итмошник студент работодатель третий ролик наш цикл направление итмый нравиться формат ставить лайк делиться страница скоро выпустить видео направление наука жизнь,44
244,день открытый дверь онлайн хотеть знать поступление бакалавриат прямой эфир ответить вопрос абитуриент мочь задать свой вопрос подключаться июль мск группа абитуриент университет итмый,24
245,привет абитуриент знакомство образовательный программа первый очередь образовательный программа бакалавриат экотехнология устойчивый развитие смотреть карточка пост знакомиться программа подавать документ узнать ещё большой образовательный программа посмотреть учебный план следить новость факультет группа вконтакте канал ссылка хотеть лично пообщаться представитель факультет получить ответ интересовать вопрос очно подать документ ждать итмый адрес кронверкский пр следующий расписание понедельник пятница суббота хэштег найти пост образовательный программа касаться обучение факультет,65
246,,0
247,поступа неклассичный студийный банда итмый июль приёмный комиссия итмый ожидаться наплыть отаку день принимать документ самый настоящий озвучкер аниме компьютерный игра ислам ганджай татьяна борзов анна мосоловый ирина евтягин даниил белый владислав токарев егор васильев июль корпус итмый адрес кронверкский пр смочь подать документ поступление итмый сдать экзамен упм выбрать корпус поступать проверить свой знание квизе побороться супер отаку бокс итмый сделать памятный фото карточка динамичный фотозон получить автограф сейя любимый персонаж кидать комментарий любимый аниме персонаж коронный фразочка встреча июль,81
248,расписание сохранять потерять следующий неделя пройти цикл трансляция абитуриент который планировать подавать заявка конкурс уникальный достижение эфир смотреть группа проект онлайн лаборатория призвать разъяснить деталь конкурс ответить частый вопрос помочь участник избежать частый ошибка составление заявка связать свой проект наиболее релевантный программа бакалавриат предстоящий эфир система критерий оценка проект наука бизнес онлайн встреча член экспертный комиссия конкурс декан замдекан доцент специалист факультет научный центр итмый пройти июль мск июль вторник михаил курушкина декан факультет биотехнология александр капитон декан факультет инфокоммуникационный технология трансляция появиться июль четверг иван логинов доцент факультет программный инженерия компьютерный техника елизавета мошуров руководитель приёмный кампания факультет технологический менеджмент инновация трансляция появиться июль среда факультет система управление робототехника научно образовательный центр инфохимия физико технический мегафакультет трансляция появиться онлайн дискуссия ы подстроить обучение университет свой проект июль четверг мск победитель конкурс бакалавр университет итмый рассказать поступать учиться бесплатно невысокий балл егэ подстраивать свой обучение развитие собственный проект трансляция появиться напомнить конкурс заменять егэ абитуриент прежний сдавать экзамен поступать бакалавриат итмый свой балл причина сдать егэ балл бояться пройти бюджет особый уникальный достижение проект софт научный статья устройство мочь пройти конкурс учиться бесплатно формально контрактный обучение университет оплатить нюанс говорить первый встреча заявка частый ошибка упаковка научно технологический бизнес проект запись ссылка обязательно задавать свой вопрос чат трансляция организатор стараться отвечать,211
249,,0
250,продолжать рассказывать самый главное направление итмый новый серия ролик очередь физика центр петербург нужный безэховый комната изучать квантовый мир стать тони старк создать свой наноробот ответить вопрос традиция помочь итмошник аспирант доктор наука второй ролик наш цикл направление итмый нравиться формат ставить лайк делиться страница скоро выпустить видео направление инженерия,50
251,год новый физтех открывать новый программа бакалавриат беспроводный технология интересовать радиофизика высокотехнологичный разработка возможность развивать свой карьера наука крупный индустриальный компания программа обязательно верить слово хороший станислав глыбовский руководитель программа беспроводный технология дмитрий жирихина куратор программа алексей слобожанюк научный сотрудник новый физтех спросить студент поступать беспроводный технология ответить технология беспроводный связь позиционирование мониторинг здоровье становиться основа цифровой экосистема будущее нужный спец который уметь делать железо чей идея способный конкурировать рынок станислав глыбовский руководитель программа беспроводный технология узнать обнаружить тёмный материя помощь беспроводный технология создать современный система интернет вещь усовершенствовать спутниковый связь разработать устройство радиочастотный идентификация повысить эффективность диагностика рак ранний стадия помощь мрт наш бакалавриат студент исследовать широкий спектр вопрос посвятить беспроводный технология первый курс смочь участвовать проектный деятельность руководство учёный мировой уровень дмитрий жирихина куратор программа ребята приобрести глубокий фундаментальный подготовка который позволить эффективно принимать правильный решение ситуация неопределённость непосредственный практический опыт работа очень востребовать область беспроводный технология прикладной проект интерес высокотехнологичный индустриальный компания алексей слобожанюк научный сотрудник новый физтех подробный узнать беспроводный технология подать документ ваш вопрос поступление смочь ответить менеджер набор дмитрий быков новыйфизтех бакалавриа,178
252,,0
253,поздравлять абитуриент сдача егэ наш скромный подарок новый чат абитуриент вступать общаться свой будущий одногруппник преподаватель ждать приёмный комиссия итмый,20
254,подключаться,1
255,,0
256,хотеть узнать вс направление итмый стесняться спросить видеть наш имиджевый ролик мечтать погрузиться глубокий скоро поступать ещё выбирать университет мечта видео спич первый рука студент выпускник преподаватель партнёр итмый сфера поделиться свой опыт обучение работа жать погружаться вместе весь человек точный наука истинный гуманитарий расстраиваться первый видео цикл направление итмый скоро рассказать весь сфера следующий выпуск направление физика нравиться формат ставить лайк делиться страница,64
257,подсказать почему работать ссылка создание личный кабинет,7
258,мечтать дерзать поступаааать календарь показывать июнь мочь значить начинать приём документ поступление итмый год ждать лично стена приёмный кампания адрес санкт петербург кронверкский пр документ подать команда приёмный комиссия очно онлайн встреча итмый,33
259,,0
260,планировать поступать бакалавриат робототехника искусственный интеллект хотеть увидеть лаборатория учиться узнать программа задать каверзный вопрос учёный мировой уровень факультет система управление робототехника университет итмый приглашать день открытый лаборатория показать оборудование реальный работа рассказать действовать проект который смочь поучаствовать время учёба июнь пер гривцов июнь кронверкский пр регистрироваться ссылка,48
261,конец май итмый пройти хакатон лишний комментарий смотреть ещё увидеть жор,11
262,подключаться первый летний день открытый дверь ответственный секретарь приёмный комиссия алексей итина представитель программа рассказывать особенность поступление бви задавать свой вопрос поступление олимпиада комментарий трансляция,25
263,сегодня мск пройти день открытый дверь победитель призёр олимпиада олимпиада школьник учитываться поступление нужно подтверждать олимпиада результат егэ стипендия ждать студент ответ вопрос прямой эфир свой вопрос смочь задать комментарий трансляция встреча,32
264,день открытый дверь победитель призёр олимпиада школьник рассказать олимпиада предмет смочь поступить бви итмый стипендия получить подробно основный этап поступление олимпиадник подключаться июнь прямой трансляция группа абитуриент университет итмый свой вопрос смочь задать комментарий прямой эфир связь,37
265,вопрос дарья козлов итмый вместе мегабайт медиа попросить первый проректор университет дарья козлов ответить вопрос самый главный ошибка совершить время обучение поступить встретить студент бар хватать образование время студенчество факультет итмый поступить ответ оставлять вопрос задать,36
