,text_tokens,text_length
476,день открытый лаборатория итмый абитуриент познакомиться направление робототехника фотоник радиофизика биотехнология экология инфохимия сотрудник лаборатория научный центр показать наука действие регистрироваться количество место ограничить участие регистрация поэтому выбирать удобный время начало приходить итмый место проведение университет итмый ул ломоносов начало экскурсия апрель продолжительность минута уникальный возможность увидеть попробовать научный жизнь университет,51
477,стартовать заочный этап олимпиада физика апрель пройти первый заочный этап школьный олимпиада физика университет итмый регистрация учиться класс попробовать свой сила решение задача максимально близкий современный научный работа победитель отбор получить ценный приз смочь посетить настоящий научный лаборатория пообщаться ведущий учёный университет подробный,43
478,начинать день открытый дверь мск рассказать поступление первый неклассический подключаться задавать свой вопрос университет итмый комментарий трансляция ответить прямой эфир запись трансляция остаться группа,24
479,,0
480,,0
481,ещё разобраться правило приём мочь определиться подавать документ знать отличаться заявление анкета рассказать подробно день открытый дверь онлайн подключаться апрель мск трансляция пройти наш группа задавать свой вопрос поступление пост ответить прямой эфир,33
482,успеть попасть последний место,4
483,создать абитуриент бот поступление смочь быстро узнать приём итмый подача документ олимпиада контракт зачисление твой виртуальный помощник изучить самый актуальный вопрос абитуриент готовый давать ответ переходить итмый,27
484,сегодняшний день открыть приём документ университет итмый подавать документ программа бакалавриат аттестат диплом пока получить документ образование нестрашно мочь завести аккаунт внести недоставать дать подробный,25
485,познакомиться итмый близкий,3
486,,0
487,ребята помочь писать заявление предоставление место общежитие стать известно получить список зачисление курс,13
488,питер учиться почему петербург хороший город студент рассказать вместе сзиу ранхигс президент рф вебинар узнать почему петербург студенческий столица россия ведущий вуз страна возможность трудоустройство лайфхак приезжий студент обязательно нужно сделать питер первый месяц жизнь скидка действовать студенческий билет подключаться начинать,41
489,март пройти урок цифра подготовить эксперт яндекс смочь заглянуть капот беспилотный транспорт разобраться технология основа узнать определить местоположение автомобиль использовать карта дать сенсор предсказать поведение участник движение построить эффективный безопасный маршрут закрепить знание помочь интерактивный тренажёр задание составить основа данные реальный автомобиль подробный урокцифра урокцифра рф,46
490,школа абитуриент,2
491,смотреть ссылка первый результат объединить межвузовский математический олимпиада февраль университет итмый пройти финальный этап олимпиада который мочь дать возможность поступить программа бакалавриат вступительный испытание апелляция состояться март университет итмый адрес кронверкский пр далее ауд приёмный комиссия,36
492,присоединяться,1
493,внимательно следить расписание день открытый дверь точно знать следующий встреча итмый ждать весь абитуриент бакалавриат конференция который ответственный секретарь приёмный комиссия ответить весь исключение ссылка конференция отправить регистрация регистрироваться выходить связь март мск,33
494,участвовать,1
495,питер учиться почему петербург хороший город студент рассказать вместе сзиу ранхигс президент рф март дорога абитуриент находиться поиск хороший город учёба пытаться выбрать москва питер думать эффективность свой студенческий год пытаться понять вообще значение иметь город который учиться помочь разобраться вебинар узнать почему петербург студенческий столица россия ведущий вуз страна возможность трудоустройство лайфхак приезжий студент обязательно нужно сделать питер первый месяц жизнь скидка действовать студенческий билет ещ далеко скоро подробно рассказать программа спикер партнёр приз пока регистрироваться следить обновление наш социальный сеть,82
496,встречаться сегодня говорить профессия ждать будущее готовиться комната позвать алексей итина ответственный секретарь комиссия итмый коллега отдел профориентация работа талант екатерина биленко николай пшеничный приключаться встречаться март комната итмый,29
497,факультет лазерный фотоник оптоэлектроника представлять образовательный программа программа бакалавриат программа магистратура март состояться день открытый дверь онлайн представитель факультет студент рассказать жизнь факультет поделиться свой опыт ответить вопрос потенциальный абитуриент онлайн режим трансляция осуществляться платформа программа бакалавриат лазерный фотоник оптоэлектроника программа магистратура прикладной фотоник смарт электроника лазерный технология квантовый технология индустрия число участник студент факультет лфо азин любовь менеджер программа бакалавриат светлана дегтярёв менеджер программа магистратура участие получение ссылка подключение необходимо пройти предварительный регистрация,74
498,мегафакультет трансляционный информационный технология прямой эфир показать устроенный национальный центр когнитивный разработка представитель студент мф рассказать свой выбор научный учебный деятельность итмый подключаться задавать свой вопрос магефакультет комментарий трансляция,29
499,онлайн день открытый дверь мегафакультет трансляционный информационный технология мегафакультет вести обучение образовательный программа бакалавриат факультет факультет информационный технология программирование факультет инфокоммуникационный технолог подключаться март мск задавать свой вопрос обучение направление мегафакультет,31
500,февраль пройти очный тур объединить межвузовский математический олимпиада пройти заочный тур оммо зарегистрироваться финальный тур олимпиада сайт университет итмый ждать адрес кронверкский пр вход сторона сытнинский улица проход университет необходимо иметь медицинский маска просить лицо участвовать олимпиада приходить университет сбор участник начаться холл этаж,44
501,начинать день открытый дверь факультет технологический менеджмент инновация технопарк итмый подключаться задавать свой вопрос факультет комментарий трансляция ответить прямой эфир,20
502,олимпиада рсош второй уровень математика очный тур олимпиада оммо объединить межвузовский математический олимпиада школьник пройти февраль пройти финальный этап забыть зарегистрироваться наш площадка прийти университет итмый принять участие подробный поступить университет итмый вступительный испытание,34
503,факультет технологический менеджмент инновация факультет готовить лидер крупный сектор инновационный экономика конкурентоспособный профессионал практик практика реальный предприятие обеспечивать будущее интересный работа задавать свой вопрос факультет комментарий ещё показать устроенный технопарк итмый подробный февраль мск онлайн день открытый дверь фтмить,39
504,подключаться день открытый дверь мегафакультет фотоник показать устроить лаборатория гибридный нанофотоник оптоэлектроника рассказать направление мегафакультет задавать свой вопрос комментарий трансляция представитель мегафакультет студент ответить,24
505,,0
506,день открытый дверь мегафакультет фотоник студент сотрудник заниматься разработка перовскитный нанофотоника оптоэлектроника лазерный система метаматериал волоконный оптический датчик квантовый коммуникация подключаться февраль мск смочь узнать ещё большой мф фотоник ещё первый история университет итмый мегафакультет который стать принимать студент вступительный экзамен биология список образовательный программа бакалавриат писать свой вопрос направление мегафакультет комментарий ответить трансляция,54
507,академия талант санкт петербург подготовить короткий видеоинтервью ответ актуальный вопрос вуз мечта смочь познакомиться близкий университет итмый узнать особенность образовательный программа порядок поступление год приоткрыть дверь насыщенный студенческий общественный жизнь вопрос отвечать ответственный секретарь приёмный комиссия итмый алексей итина,39
508,выпуск подкаст павел маврина руководитель кружка олимпиадный информатика университет итмый рассказать правильно готовиться олимпиада улучшить навык решение нетривиальный задача класс нужно начинать подготовка олимпиада язык программирование должный знать студент кружка работать летний лагерь программирование отличаться олимпиадный информатика формат возраст приходить кружок класс проходить олимпиада информатика сколько ребята кружка поступать итмый помогать подготовка кружка поступление итмый кружок олимпиадный информатика,58
509,начинать день открытый дверь мегафакультет биотехнология низкотемпературный система сегодня показать устроенный международный научный центр биотехнология третий тысячелетие исследование проводиться задавать свой вопрос обучение исследование комментарий трансляция представитель мегафакультет ответить прямой эфир,31
510,знакомство мегафакультет биотехнология низкотемпературный система встреча пройти онлайн формат представитель студент мегафакультет рассказать свой научный разработка образовательный программа внеучебный жизнь университет итмый подключаться февраль мск задавать свой вопрос мф бтинс смочь посмотреть прямой эфир запись сохранить наш группа ещё показать научный лаборатория мегафакультет изнутри,44
511,сергей фадеев преподаватель академия информатика программирование университет итмый язык программирование актуальный главное знать фундамент направление мочь развиваться программист работа шник считаться творческий системный проходить занятие академия информатика университет итмый,29
512,день открытый дверь лаборатория сегодня идти гость мегафакультет компьютерный технология управление смочь попасть увидеть изнутри работа международный лаборатория узнать научный деятельность заниматься факультет направление свой вопрос представитель мегафакультет кту задавать комментарий трансляция,32
513,помнить понедельник выходной,3
514,знакомство мегафакультет компьютерный технология управление воскресение февраль прямой эфир встретиться представитель студент мегафакультет узнать возможность открываться время обучение развиваться выпуск история итмый встречаться международный лаборатория информационный безопасность киберфизический система мск поэтому смочь увидеть изнутри подключаться трансляция пройти наш группа,39
515,образование физика,2
516,вуз нужно выбирать холодный ум горячий сердце узнать поступление информационно технологический направление направление креативный индустрия университет итмый регистрироваться курс онлайн школа фоксфорд поступление вуз любовь подключаться занятие январь алексей леонидович итина начальник управление студенческий медиа ответственный секретарь приёмный комиссия университет итмый январь арт м александрович смолин директор центр юзабилить смешанный реальность университет итмый кандидат философский наука,56
517,начинать день открытый дверь бакалавриат ответственный секретарь приёмный комиссия лично рассказывать особенность приём задавать свой вопрос поступление комментарий трансляция ответить прямой эфир,22
518,онлайн день открытый дверь близкий полгода встречаться наш группа вконтакте онлайн трансляция ещё видеть полный список весь додов сохранять пропустить первый встреча год пройти ответственный секретарь приёмный комиссия основный шаг поступление начало январь мск задавать свой вопрос приём пост ответить прямой трансляция,42
519,кафедра кт предлагать сделать передышка подготовка финал олимпиада егэ приглашать очередной время стрим пообщаться студент образовательный программа обсудить учёба стажировка крутой компания ещё узнать подробность поступление организация учебный процесс руководитель образовательный программа андрей станкевич февраль мск стрим группа подробный информация мероприятие,41
520,воскресение январь мск начаться отборочный этап чемпионат сочинение свой слово естественно научный инженерный технологический направление зарегестрироваться письмо ссылка платформа пройти тестирование прийти почта который указать регистрация чемпионат мочь найти проверить папка спам рассылка писать подробный читать сайт чемпионат социальный сеть,40
521,расписание день открытый дверь запоминать интересный подключаться интересный полезный университет итмый студент преподаватель встреча онлайн,15
522,упустить шанс принять участие олимпиада который победа дать возможность поступление вступительный испытание объединить межвузовский математический олимпиада январь г открытый олимпиада школьник информатика математика февраль г полный список олимпиада рсош давать право поступление бви год абитуриент итмый ознакомиться ссылка,38
523,наш скромный новогодний подарок новый чат абитуриент вступать общаться свой будущий одногруппник преподаватель ждать приёмный комиссия итмый,17
524,новогодний подарок ответственный секретарь приёмный комиссия итмый завтра декабрь смочь лично пообщаться алексей итин поступление обучение университет выйти связь позвонить телефон приёмный комиссия забыть написать новый чат наш группа вконтакте воспользоваться диалог ещё доступ ресурс открыться мск ставить будильник пропустить,40
525,говорить успешно стартовать робототехника игорь лосицким сотрудник подразделение международный научный центр нелинейный адаптивный система управление заведовать лаборатория молодёжный робототехника тренер команда чемпион мир робототехника дисциплина нужно изучить делать проект сфера робототехника школьник формат проходить занятие ваш лаборатория проект побеждать международный соревнование лаборатория организовать работа условие пандемия занятие лаборатория молодёжный робототехника время проходить старт готовый продукт,55
526,начинать последний день открытый дверь задавать свой вопрос итмый комментарий трансляция отвечать прямой эфир запись эфир остаться группа,18
