,text_tokens,text_length
771,сегодня последний день первый этап интернет олимпиада физика давать право поступить вступительный испытание участник мочь стать учиться класс поторопиться олимпиада уровень рсош давать бви поступление итмый золотой студенческий билет принять участие нужно предварительно зарегистрироваться сайт каждый учебный год участник регистрироваться заново прошлогодний уч тный запись подходить установить программа иначе работа модель виртуальный лаборатория физика недоступный заранее настроить работа модель компьютер который проходить тур начало тур сразу регистрация доступный тренировочный задание кудапоступать абитуриент,72
772,запись декабрь успеть записаться подготовиться егэ,6
773,декабрь пройти день открытый дверь университет итмый узнать вс поступление итмый вариант прийти кронверкский пр включить прямой трансляция группа абитуриент университет итмый предлагать задать вопрос трансляция прямой эфир который смочь получить ответ кудапоступать абитуриент,34
774,подробно лауреат нобелевский премия открытие рассказать астрофизик александр иванчик автор цикл работа спектроскопия квазар космология профессор ведущий научный сотрудник фти ф иофф поделиться информация олимпиада давать право поступление вступительный испытание рассказать наш учебный лаборатория особенность обучение новый физтех кудапоступать абитуриент,40
775,олимпиада физика давать право поступить вступительный испытание ноябрь декабрь проходить й тур интернет олимпиада школьник физика класс организовать университет итмый спбгу напоминать олимпиада уровень рсош давать бви поступление итмый золотой студенческий билет принять участие нужно предварительно зарегистрироваться сайт каждый учебный год участник регистрироваться заново прошлогодний уч тный запись подходить установить программа иначе работа модель виртуальный лаборатория физика недоступный заранее настроить работа модель компьютер который проходить тур начало тур сразу регистрация доступный тренировочный задание кудапоступать абитуриент,75
776,пятница ноябрь состояться день открытый дверь физико технический факультет итмый традиция немой обсудить нобелевский премия физика год подробно лауреат премия открытие рассказать астрофизик александр иванчик автор цикл работа спектроскопия квазар космология профессор ведущий научный сотрудник фти ф иофф поделиться информация олимпиада давать право поступление вступительный испытание рассказать наш учебный лаборатория особенность обучение новый физтех ждать весь мечтать карьера учёный неровно дышать наука кронверкский актовый зал этаж кудапоступать абитуриент,68
777,итмый гугл,2
778,воскресение пройти сразу событие день открытый дверь мегафакультет биотехнология низкотемпературный система день открытый дверь факультет лазерный фотоник оптоэлектроника мочь интересовать биотехнология задумываться энергетика низкотемпературный техника криогенный система хотеть стать востребовать специалист область лазер оптоэлектроника приходить мероприятие выбрать свой будущее кудапоступать абитуриент,41
779,день открытый дверь мегафакультет биотехнология низкотемпературный система ноябрь адрес ул ломоносов далее ждать вс программа подготовка бакалавр мегафакультет история успех выпускник факультет получить ответ интересовать вопрос познакомиться образовательный программа школьник начаться экскурсия учебный научный лаборатория мегафакультет подробный кудапоступать абитуриент,39
780,университет итмый набирать программа химия ещё химия биология знать знать понедельник сделать день знание тяжёлый проблема растворить предлагать ребята мегабайт медиа лёгкий неделя кудапоступать абитуриент,25
781,завтра пропустить возможность получить дополнительный балл егэ,7
782,хотеть стать востребовать специалист область лазер оптоэлектроника мечтать заняться наука работать реальный проект ещё определиться будущее искать интересный место получение высокий образование день открытый дверь факультет лазерный фотоник оптоэлектроника университет итмый приходить ноябрь адрес пер гривцов подробный информация регистрация ссылка кудапоступать абитуриент,42
783,добрый день перевестись курс бонч бруевич программный инженерия,8
784,день открытый дверь свежий воздух,5
785,ноябрь университет итмый пройти день открытый дверь мегафакультет трансляционный информационный технология предстоять узнать правило ма год получить информация обучение данный мегафакультет пообщаться студент выпускник смочь получить ответ интересовать вопрос нужно знать уметь стать высококлассный специалист область случиться кафедра компьютерный технология кт мочь время обучение поехать стать специалист любой область учиться программист жд м адрес кронверкский пр далее холл первый этаж кудапоступать абитуриент,62
786,завтра пропустить провести день открытый дверь поступать бакалавриат формат трансляция начаться московский время группа абитуриент университет итмый вопрос ещё задать ответ прозвучать трансляция новенький кудапоступать абитуриент,26
787,найти расписание день открытый дверь итмый мегафотоник интересовать год январь май,11
788,добрый день перевестись курс информатика подготовка егэ олимпиада курс подготовка егэ,11
789,привет известно проходить олимпиада итмый вконтакте,6
790,ноябрь год университет итмый пройти день открытый дверь поступать бакалавриат формат трансляция начаться московский время группа абитуриент университет итмый задать вопрос узнать вс университет итмый поступление результат приём друг выходить дом кудапоступать абитуриент,33
791,подсказать необходимо перевод курс институт рф факультет дизайн узнать наличие свободный место,12
792,ноябрь состояться день открытый дверь факультет прикладной оптика университет итмый пер гривцов далее абитуриент программа бакалавриат специалитет магистратура начало смочь задать вопрос ответственный м факультет посмотреть научный лаборатория узнать проект реализовать пообщаться студент который недавно стать участник программа обмен получить памятный подарок итмый регистрация открыть ссылка приходить посмотреть кудапоступать абитуриент,50
793,день открытый дверь мегафакультет компьютерный технология управление кронверкский пр октябрь год приходить узнать вс мегафакультет поступление ктиу программа прикрепить кудапоступать абитуриент,21
794,занятие информатика подготовительный курс каникулы,5
795,октябрь университет итмый пройти день открытый дверь мегафакультет компьютерный технология управление ждать интерактивный зона смочь познакомиться разработка вуз студенческий лаборатория технология умный дом виртуальный реальность робот квадрокоптер пообщаться студент презентация мегафакультет ктиу факультет программный инженерия компьютерный техника пиикт система управление робототехника суир безопасность информационный технология битый вс правило приём год регистрироваться ссылка приходить кудапоступать абитуриент,55
796,,0
797,сайт найти конкретный информация олимпиада давать бви балл благодарный прояснение вопрос,11
798,октябрь состояться день открытый дверь мегафакультет фотоник университет итмый кронверкский пр узнать заниматься технический зрение квантовый коммуникация лазерный технология адресный доставка лекарство биоинженерия создавать новый существующий природа материал стать успешный уч ным инженер руководитель лаборатория разработчик поступить университет итмый приходить посмотреть кудапоступать абитуриент,43
799,обратить внимание олимпиада писать заглавный буква скоро стартовать первый этап олимпиада рсош год стать призёр победитель поступить вступительный испытание получить стипендия руб мес подробный кудапоступать абитуриент,26
800,добрый день хотеть подробный узнать поступление иностранный абитуриент ваш университет жить беларусь хотеть поступить ваш вуз желательно бесплатный основа нужно сдать егэ внутренний экзамен заранее ответ нибыть студент беларусь поступить год написать лс парочка вопрос,35
801,начинать первый учебный год день открытый дверь связь присоединяться смочь прийти,11
802,стать близкий университет итмый получить фирменный подарок университет итмый нужно вступить наш группа абитуриент университет итмый дождаться окончание день открытый дверь октябрь воскресение счастливчик время день открытый дверь сцена актовый зал получить крутой подарок университет итмый встретиться первый неклассический кудапоступать абитуриент,41
803,сказать очно заочный форма обучение направление,6
804,первый учебный год день открытый дверь октябрь ждать кронверкский пр ждать презентация мегафакультет факультет подведение итог учебный год прошедший кампания весь информация правило ма бакалавриат год подробный поступать правильно кудапоступать абитуриент,31
805,поступление бви результат олимпиада рсош текущий год подробный прочесть правило поступление бви,12
806,первый учебный год день открытый дверь октябрь ждать кронверкский пр ждать презентация мегафакультет факультет подведение итог учебный год прошедший кампания весь информация правило ма бакалавриат год подробный поступать правильно кудапоступать абитуриент,31
807,смешно познавательный среда,3
808,университет итмый икси академия фсб россия приглашать октябрь учиться класс принять участие квест информационный безопасность форт боярд участие бесплатный количество место ограничить квест форт боярд увлекательный познавательный игра время который школьник поделить команда каждый команда предстоять посетить лаборатория комната связанный различный сфера информационный безопасность пройти испытание школьник искать шпионский техника вскрывать ручной шифр пытаться обнаружить спрятать информация проходить квест участник игровой форма познакомиться основный направление информационный безопасность победитель получить подарок диплом время начало место проведение санкт петербург ул ломоносов дом университет итмый факультет битый регистрация необходимо отправить информация адрес тема письмо квест форт боярд октябрь университет итмый письмо указать следующий информация фио город школа класс электронный почта номер телефон контактный лицо екатерина николаевич кудапоступать абитуриент,115
809,регистрация университет итмый открытие октябрь проект смочь узнать весь информация технический специальность познакомиться университет итмый близкий заполучить балл егэ упустить свой шанс регистрироваться ссылка описание кудапоступать абитуриент,27
810,участвовать олимпиада кружковой движение нти школьник класс включаться сообщество первый командный инженерный олимпиада год пройти ый выбрать участие профиль искусственный интеллект аэрокосмический система нанотехнология урбанистика гуманитарный направление победитель большинство профиль получить балл егэ приглашение масштабный образовательный интенсив бонус каждый участник ждать практический задача ведущий технологический компания вуз возможность участвовать дом первый тур работа передовой лаборатория хакатон встреча единомышленник специальный мероприятие участник вс олимпиада кд нти первый тур дистанционный финал очный пройти разный регион база ведущий вуз площадка отборочный тур индивидуальный этап участник объединяться команда решать задание вместе старт октябрь спешить участвовать регистрация открыть ссылка полный список направление олимпиада смотреть сайт кудапоступать абитуриент олимпиаданти олимпиадакднтить кружковоедвижение нти онтить,107
811,конкурс уникальный достижение абитуриент желать поступить университет итмый подробный программа давать возможность талантливый мотивированный выпускник школа обучаться бесплатно университет итмый балл егэ позволять претендовать бюджетный место подробный год конкурс поступить вдвое большой заявка школьник весь страна прошлый год победитель стать участник петербург москва челябинск псков абакан город победитель сайт подробный кудапоступать абитуриент,52
812,весь привет год сдавать егэ тобыть скоро ваш абитуриент связь хотеться пообщаться студент отсюда отписаться комментарий личка заранее,18
813,регистрация открыть,2
814,добрый день родитель регистрироваться попасть день открытый дверь,8
815,планировать поход университет итмый заранее рада начать рассказывать поступление год университет итмый ждать ряд мероприятие очный онлайн следить новость расписание график день открытый дверь итмый абитуриент кудапоступать абитуриентитмый абитуриент,29
816,топ,1
817,университет итмый бриллиантовый лига первый российский рейтинг университет весь рейтинг российский вуз поделить топ бриллиантовый золотой серебряный медный университет итмый бриллиантовый топ место вместе ещё университет подробный итмый абитуриент кудапоступать абитуриентитмый абитуриент,32
818,начать готовиться поступление,3
819,приходить узнать университет итмый мочь дать ученик класс,8
820,финальный информация поступить,3
821,разбирать студенческий билет счастливчик который получить золотой серебрять бронзовый студенческий билет стипендия известный учиться стипендия продлиться второй семестр список студент получить свой счастливый билет радоваться веселиться университет итмый большой университет итмый абитуриент кудапоступать абитуриентитмый абитуриент,35
822,ещё уйти группа первокурсник университет итмый посмотреть информация,8
823,выдыхать мный кампания год закончиться вс время вопрос отвечать эмиль гареев руководство алексей итина насущный вопрос группа первокурсник университет итмый приказ сайт добро пожаловать первый неклассический итмый абитуриент кудапоступать абитуриентитмый абитуриент,31
824,внимательный сегодня понедельник приёмный комиссия бакалавриат работать далее пн пт сб вс выходной внимание,14
825,подводить итог,2
826,группа первокурсник университет итмый создать наслать свой одногруппник новый друг любовь весь актуальный информация переходить вступать ваш первый неклассический,19
827,приказ второй этап искать список ждать поступать контракт семья полный сбор последний приказ август надеяться смочь составить компания нелёгкий путь поступление итмый абитуриент кудапоступать абитуриентитмый абитуриент,26
828,число досдать оригинал контракт заключить отправить бояться успеть дойти,9
829,поздравлять поступить добавить беседа инноватик бизнес информатика писать,8
